{
  "$schema": "https://json-schema.org/draft/2020-12/schema",
  "$id": "https://peacprotocol.org/specs/conformance/parity-corpus/runtime-governance/vectors.schema.json",
  "title": "Runtime-governance parity corpus vectors",
  "description": "Schema for managed-runtime wedge parity vectors. Covers the 6 observation-specific type URIs from @peac/adapter-runtime-governance plus at least one negative vector.",
  "type": "object",
  "additionalProperties": false,
  "required": ["family", "description", "version", "vectors"],
  "properties": {
    "family": { "const": "runtime-governance" },
    "description": { "type": "string", "minLength": 1 },
    "version": { "type": "string", "pattern": "^[0-9]+\\.[0-9]+\\.[0-9]+$" },
    "generator": { "type": "string" },
    "vectors": {
      "type": "array",
      "minItems": 7,
      "items": { "$ref": "#/$defs/vector" }
    }
  },
  "$defs": {
    "vector": {
      "type": "object",
      "additionalProperties": false,
      "required": ["id", "description", "input", "expected"],
      "properties": {
        "id": { "type": "string", "pattern": "^[a-z0-9-]+$", "minLength": 1, "maxLength": 64 },
        "description": { "type": "string", "minLength": 1, "maxLength": 512 },
        "input": { "$ref": "#/$defs/input" },
        "expected": { "$ref": "#/$defs/expected" }
      }
    },
    "input": {
      "type": "object",
      "additionalProperties": false,
      "required": ["payload"],
      "properties": {
        "payload": { "type": "object" },
        "header": { "type": "object" }
      }
    },
    "expected": {
      "type": "object",
      "additionalProperties": false,
      "required": ["accepted"],
      "properties": {
        "accepted": { "type": "boolean" },
        "errors": {
          "type": "array",
          "items": { "$ref": "#/$defs/diagnostic" }
        },
        "warnings": {
          "type": "array",
          "items": { "$ref": "#/$defs/diagnostic" }
        }
      }
    },
    "diagnostic": {
      "type": "object",
      "additionalProperties": false,
      "required": ["code"],
      "properties": {
        "code": { "type": "string", "minLength": 1, "maxLength": 128 },
        "path": { "type": "string", "maxLength": 256 }
      }
    }
  }
}
